{
  "$schema": "https://json-schema.org/draft/2020-12/schema",
  "$id": "https://roamory.app/contracts/evaluation.schema.json",
  "title": "Evaluation",
  "description": "200 response of POST /v1/evaluate. The phone stores it in its Evaluation record (TRD 3.3) and copies verdict.event_type and verdict.description into the Moment.",
  "type": "object",
  "additionalProperties": false,
  "required": ["version", "keep", "latency_ms", "verdict"],
  "properties": {
    "version": {"type": "integer", "const": 1},
    "keep": {
      "type": "boolean",
      "description": "Server decision: verdict.save_decision = save. Always true for purpose = describe. false releases the phone's speculative hold."
    },
    "latency_ms": {"type": "integer", "minimum": 0, "description": "Server time for the whole request."},
    "verdict": {
      "type": "object",
      "additionalProperties": false,
      "description": "Model output (TRD 8.2), with enums coerced and text truncated by the server. The model decides; it gives no scores.",
      "required": [
        "event_type",
        "matched_preferences",
        "save_decision",
        "best_frame_index",
        "window_hint_s",
        "description",
        "reason"
      ],
      "properties": {
        "event_type": {
          "type": "string",
          "enum": ["scenery", "landmark", "activity", "food", "social", "other"]
        },
        "matched_preferences": {"type": "array", "items": {"type": "string"}},
        "save_decision": {
          "type": "string",
          "enum": ["save", "skip"],
          "description": "The model's keep-or-skip decision. When it cannot tell, it skips."
        },
        "best_frame_index": {
          "type": "integer",
          "minimum": 0,
          "maximum": 2,
          "description": "0-based index into the frames sent; always below the number of frames."
        },
        "window_hint_s": {
          "type": "object",
          "additionalProperties": false,
          "required": ["pre", "post"],
          "description": "Suggested seconds to keep before and after frame t. The phone may extend its hold toward this, up to its own caps.",
          "properties": {
            "pre": {"type": "integer", "minimum": 0, "maximum": 30},
            "post": {"type": "integer", "minimum": 0, "maximum": 30}
          }
        },
        "description": {
          "type": "string",
          "maxLength": 200,
          "description": "At most 20 words, only what is visible. Becomes agent_request clips[].description."
        },
        "reason": {"type": "string", "maxLength": 200, "description": "At most 25 words. For logs and tuning."}
      }
    }
  }
}
