{
  "version": 1,
  "keep": false,
  "latency_ms": 1650,
  "verdict": {
    "event_type": "other",
    "matched_preferences": [],
    "save_decision": "skip",
    "best_frame_index": 1,
    "window_hint_s": {"pre": 15, "post": 15},
    "description": "Crowded train platform with people waiting",
    "reason": "Transit scene; little to keep for this trip"
  }
}
