{
  "version": 1,
  "keep": true,
  "latency_ms": 1840,
  "verdict": {
    "event_type": "landmark",
    "matched_preferences": ["scenery", "landmark"],
    "save_decision": "save",
    "best_frame_index": 2,
    "window_hint_s": {"pre": 15, "post": 15},
    "description": "Orange torii gates lining a stone path",
    "reason": "Iconic scenic landmark that fits a honeymoon"
  }
}
